{
  "schema_version": 1,
  "fixture_id": "fixture_synthetic_zip_001",
  "classification": "synthetic-valid",
  "rights": {
    "redistribution": "allowed",
    "license": "CC0-1.0",
    "source": "Generated by the Modlock test suite"
  },
  "input": {
    "path": "fixtures/generated/synthetic-valid.zip",
    "sha256": "bbbbbbbbbbbbbbbbbbbbbbbbbbbbbbbbbbbbbbbbbbbbbbbbbbbbbbbbbbbbbbbb",
    "size": 512
  },
  "expected": {
    "decision": "accept",
    "code": "ARCHIVE_ACCEPTED",
    "inventory_paths": ["payload/synthetic_dir.vpk"],
    "notes": "Example only; generated artifact digest is replaced by the fixture generator."
  }
}

